1,――アイラひとりでやってたよね。
2,――！
3,“できるか不安だと言う”
4,“任せてと胸を張る”
5,…………
6,……いいの？
7,……そう、だよね
8,……どうして、喜んでるの？
9,……アイラの大切な想い出の場所。
10,……ダメ、かな？
11,……ツカサは、このハーブのこと知ってる？
12,……メモは、平気？
13,……俺、頑張るよ
14,……手伝うだけ、なら
15,……見つけた。ここ、マジョラムのページ
16,……長寿の、ハーブ？
17,……頑張ってみるよ。でも、アイラみたいにうまくできなくても、怒らないでね？
18,……！
19,「ハーブのレクチャー」
20,あ、あはは……
21,あ、うん……
22,あのね……
23,あのね、ツカサ
24,あれ、続きは？
25,うん
26,うん、分かってるって
27,うん。ちゃんと取れてるよ
28,うん。ツカサのそういうところ、私は……
29,え、ミチル用？
30,ええと……
31,えっ、そうなの？
32,えへへ……
33,え？
34,かけがえのない、絆だったんだ。
35,ここにあるハーブの説明から
36,ここには２０種類近いハーブがあるけど、アイラは言葉に迷わなかった。
37,ここまで愛情を注げたのも、そのことがあったからなのかもしれない。
38,こっちのタイムは、夏の暑さに弱いので気を付けて
39,この本のこと？　これはミチル用
40,これは、カモミール
41,さすが、ツカサはマニュアル人間。ちゃんとしてる
42,じゃあ、はじめに……
43,じゃあ、手伝いだけ。それならいいよね？
44,すごいね
45,せ、せんせい？
46,そ、そっか。私が、先生……
47,そういうこと
48,そうか、アイラにとってハーブは、ターミナルサービスのみんなと自分を繋ぐためのもの。
49,そうかな？　でもアイラに追いつくには、もっと勉強しないとね
50,そうだなぁ……
51,そう思って、アイラと手を繋ぐ。
52,そう言い終える前に、ハッとして口を閉じた。
53,そう言ってアイラは少し小さめの本を手にとって、パラパラとページをめくる。
54,そこにはマジョラムの写真からはじまって、効能、花言葉、歴史といった内容が書かれていた。
55,そして、その相手に俺を選んでくれた。
56,そして、今日もアイラと一緒に会社へ向かった。
57,そっか！　じゃあ、決まりだね
58,その大きな期待を、裏切ることなんてできなかった。
59,その眼差しに、俺は……。
60,それくらいになれば、きっとハーブを枯らす心配はないはず。
61,それって、どういう意味だろう？
62,それって、褒め言葉？
63,それなら、初心者の俺にもできそうだ。
64,それに、みんなが私の淹れたお茶、おいしいって言ってくれると、私はまだここにいていいんだ、って思えて
65,それはありがたいかも。でも、アイラの負担にならない？
66,それは予想に反した内容だった。
67,それは場合による
68,それを自分が引き継ぐんだと思うと、身が引き締まった。
69,だ、だだだ、だいじょうぶ……
70,だから、おおげさに胸を張ってみせた。
71,だったら。
72,だって、ツカサがずっと元気でいてくれたら、嬉しい
73,つまりレシピ本は、ミチルにあげるハーブを調べるための本で。だから、ミチル用？
74,できるか不安だと言う
75,でも、なぜか。
76,でも、名前とか特徴までは分からなかった。
77,でも言ってから、急に恥ずかしくなってきた。
78,と、その視線は俺に止まった。
79,と、次の瞬間。
80,ということは、一緒にしてほしいっていうのはハーブに関係することなのかな。
81,とりあえずは、大丈夫。あとは実際にやりながら覚えていくよ
82,と思っていたら。
83,どうかした？
84,どうして、俺なの？　そもそもハーブのことは今まで――
85,どの本もかなり読み込んでるみたいで、付箋や蛍光ペンの印でいっぱいだ。
86,どんなことだろうと首を傾げる。
87,ない
88,なるほど
89,はじめて聞いた、アイラの気持ち。
90,ひとつのハーブに集中する。
91,ふと目に入った文字。
92,ふふっ
93,へえ！　確かに、面白いね
94,まずは、アイラくらいハーブのことをスラスラ説明できるようになろうと思う。
95,みんなのために、そこまでしてたんだ。
96,もし、自分がアイラにそんなことされたら、ショックで立ち直れないよ……。
97,もっと、いろいろ、育ててみたかったな
98,やり方はちゃんと教えるつもり。それでもダメ？
99,よかった
100,よろしくお願いします、アイラ先生
101,アイラ
102,アイラ_159487b339efb0b40512d2ef9e458201
103,アイラ_23efe76422489e13e9df73b22544086f
104,アイラ_3165bfb57a21b75507c599fd720bbbb4
105,アイラ_597c4723ed5ba4ac9b6046d97f5b9d3a
106,アイラ_6b44db9b37a77a4d615f2a69bd3b72fb
107,アイラ_770befe1a9fb09e86b240efff000ec85
108,アイラ_896bb58ce5d3faef5d645eb1cb9d4074
109,アイラ_ac6aa65f9207ab592ab301672d0002c7
110,アイラ_c05fde4c4c76d6f76ffd6f5928c6de31
111,アイラ_cf8c0f6a37021b71da92642e2b19b4af
112,アイラ_ddfe3a6c02f159ab2418096363e942a5
113,アイラ_ea32798f0022b98b65e00d970c3b5112
114,アイラ、大丈夫！？
115,アイラがじっと見つめてくる。
116,アイラが丁寧に見ていただけあって、どれも綺麗に葉を伸ばしている。
117,アイラが指差す先には、白い小さな花をつけたハーブがあった。
118,アイラって、ハーブのことにすごく詳しいよね。かなり勉強した？
119,アイラに手を貸して、ゆっくりとキッチンへ移動する。
120,アイラに教えられてばかりだった今日一日。だから、少しでも役に立ちたい。
121,アイラのこと、大好きだから
122,アイラのことを考えると、長寿という言葉は皮肉のように感じられた。
123,アイラのハーブに対する愛情が伝わってきて、なんだか微笑ましかった。
124,アイラの視線が隣のハーブへ移った。
125,アイラはすっと視線を逸らした。
126,アイラはそう言うだけで、詳しいことまで話してはくれなかった。
127,アイラはふと言葉を止めて、頬を赤らめた。
128,アイラはもうすぐ寿命を迎える。そうなる前に世話を頼みたいって思ってるんだ、自分以外の誰かに。
129,アイラはハーブを使った料理とか興味あったりするの？
130,アイラはプランターの前にしゃがんで、目の前の白い小さな花を見つめた。
131,アイラは嬉しそうにしていた。
132,アイラは本を俺の方へ向けてくれる。
133,アイラは気持ちを切り替えるように、一度深呼吸をして、再びハーブの説明をはじめた。
134,アイラは決意したように口を開いた。
135,アイラは照れくさそうに微笑んだ。
136,アイラは穏やかな顔で、周囲のハーブを見回した。
137,アイラは花壇をざっと見回して、少し考えこんだ。
138,アイラは訴えるように、一度も視線を外さない。
139,アイラは遠慮がちに、こくりとうなずいた。
140,アイラみたいに、ここにあるハーブ、全部ちゃんと育てたい
141,アイラを安心させたい。
142,カモミールが元気なうちは、他のハーブも元気でいられる。だから、カモミールのことを一番気にかけてほしい
143,カモミールは１年草。ずっと葉が付いてるの
144,ガンッ！　と思い切りテーブルに足をぶつけた。
145,タイムは暑さに弱いから注意が必要で、ローズマリーは暑さに強い。ただ、茂り過ぎると――
146,ダメ。自分でやりたいの
147,ダメじゃないよ。ただ、できるかどうか不安で……。俺って、植物の世話とかほとんど経験ないから
148,ツカサ
149,ツカサがよければ、仕事が終わってからでも、もっと教えるよ
150,ツカサが好きなマジョラムにも、たぶんなにかあると思う
151,ツカサなら、きっとできる
152,ツカサなら、そう言ってくれるって思ってた
153,ツカサにハーブの世話をしてもらいたいの
154,ツカサは、大切な人だから
155,テーブルを占領するのは、アイラ愛用のハーブ参考書。
156,ハーブが好きなことは知ってたけど、ここまで詳しかったなんて。
157,ハーブそれぞれの説明、水やりの時間、ハーブを摘むときのアドバイス、枯れたときの対処方法、オススメの肥料を売ってるお店の場所――。
158,ハーブに視線を送りながら、アイラはよどみなく説明を続ける。
159,ハーブのこと好きなので。好きな話をするのは、楽しい
160,ハーブの歴史とか雑学が好きっていう人もいるみたい
161,ハーブの説明、続けるね
162,ハーブはね、育てるのも楽しいけど、それ以外にも楽しいことがたくさんあるの
163,マジョラムって、そういう意味だったんだ
164,マジョラムは、アイラに淹れてもらってはじめて知ったハーブだ。
165,メモ帳をしまって、改めてハーブが茂るプランターを見回した。
166,メモ帳を引っ張り出す。もしものときに持ち歩いていたのが幸いした。
167,ローズマリーは乾燥させた後も香りが残るから、消臭剤として使えるの。部屋からヤスタカのニオイを消せるって、いつも喜んでくれる
168,一方アイラは気をよくしたみたいで、目をキラキラと輝かせている。
169,一緒にしてほしいこと？
170,世話に必要な情報は、一通り揃ってると思う。
171,中
172,以来マジョラムは長寿を象徴するハーブとされているとか。
173,任せてと胸を張る
174,任せてよ。期待に応えてみせるから
175,会社に行ったら、一緒にしてほしいことがあるの
176,会社に行ったらってことは、仕事に関係することなんだろうけど。
177,会社のハーブが茂り過ぎたとき、人にあげるようにしてるの。でも意味もなくあげると迷惑だから、誰にあげるべきか本で調べて決めてる
178,俺はまだ、アイラが淹れてくれたハーブくらいしか分からないけど。
179,俺は寿命のことを気にし過ぎているのかもしれない。
180,俺は心の中でそう決めた。
181,俺も、アイラがずっと元気で、ずっと笑顔でいてくれたら、すごく嬉しいって思う
182,出社したら分かるし、今はいいか。
183,出社の支度を終えて、部屋を出ようとしたときだった。
184,出社後、案内されたのはオフィスの裏手。アイラがハーブを育てている場所だ。
185,分かった
186,勉強教えるのは先生の仕事でしょ？
187,参考書のほとんどはハーブの知識や育て方に関するものだけど、一応レシピ本なんてのもあった。
188,取ったばかりのメモを見返してみる。
189,周りの植物を？
190,夜はまだ浅い時間。勉強会もはじまったばかり。
191,好きな人がいつまでも元気でいてくれたら、それはとても喜ばしいこと。
192,寝るまでの間に少しでもアイラの期待に応えよう。
193,少しだけ気持ちが楽になるのを感じながら、アイラが気を遣ってこのことを最初に教えてくれたのかもしれないと思った。
194,左
195,帰宅後。
196,引き受けてくれて、ありがとう
197,当たり前のことのはずなのに、言われるまで気付かなかった。
198,意外にもアイラの返事は手厳しかった。
199,料理以外だと、シェリーにローズマリーをあげたりしてる
200,昔ミントを税金として納めさせてた国があったとか、そういうの
201,本当に医者みたいだ。
202,植物のお医者さんって呼ばれてて、周りの植物を元気にしてくれるの
203,植物を育てたことなんて、ほとんどないんだけどな。
204,次は、手入れの説明
205,正直な気持ちを言葉にした。
206,無理しないで。お茶なら俺が淹れるから、ね？
207,無理にとは言わない。だけど、できればツカサにお願いしたくて
208,痛みをこらえてプルプル震えながらも、頑として譲らないアイラ。
209,目_ショック:口_ショック
210,目_ドヤ顔:口_ドヤ顔
211,目_困惑:口_困惑
212,目_困惑:口_笑顔
213,目_微笑み:口_微笑み
214,目_悲しみ:口_悲しみ
215,目_泣き:口_泣き
216,目_照れ:口_照れ
217,目_目閉じ:口_目閉じ
218,目_真剣:口_真剣
219,目_笑顔:口_笑顔
220,目_興奮:口_興奮
221,目_通常:口_通常
222,私、お茶淹れてくる！　ツカサの好きなマジョラムティー
223,種が勝手に落ちて、どんどん新しい芽が出てくるから、ほっといたら増え過ぎちゃう。良くないものがあったら、取り払った方がいい
224,簡単に夕食を済ませてから、ハーブ勉強会がはじまった。
225,肥料を運ぶのに男手が要るとか？
226,育てはじめたときは、時間、いっぱいあったので
227,自分が好きなハーブの話とか聞いたら、きっと楽しいんだろうな
228,興奮気味に立ち上がるアイラ。
229,行ったら、分かるので
230,見たことは、あると思う……
231,言おうと思ったけど……今は仕事中なので
232,言葉とは裏腹に、テーブルに手をついたまま動けなくなっている。
233,説明は、こんなところ
234,説明は簡潔で、的確。
235,説明文によると、マジョラムは昔、薬草として使われていて人々の寿命を延ばしたことから、ラテン語で『より大きい』を意味するマジョラムっていう名前が付けられたという。
236,質問ある？
237,逆にローズマリーは、暑さに強い。ただちゃんと手入れしないと、葉が茂り過ぎちゃって下の方が枯れちゃう。夏になったら一度収穫すべき
238,雑学？
239,飲みやすいから、ほとんど毎日飲んでたりする。